{
  "matrix_row": "EXP-01",
  "frozen_plan_sha256": "0000000000000000000000000000000000000000000000000000000000000000",
  "seed": {
    "role": "fixed_repro",
    "value": 42
  },
  "data": {
    "path": "data/input.csv",
    "sha256": "0000000000000000000000000000000000000000000000000000000000000000",
    "source_revision": "replace-with-fixed-revision",
    "split_id": "replace-with-frozen-split"
  },
  "features": {
    "baseline": ["feature_a"],
    "candidate_additions": ["feature_b"]
  },
  "model": {
    "name": "replace-with-model",
    "hyperparameters": {}
  },
  "evaluation": {
    "unit": "patient",
    "primary_metric": "brier",
    "folds": 5
  },
  "runtime": {
    "device": "cpu",
    "dtype": "float64",
    "mixed_precision": false
  }
}
